{
  "type": "OfflineAuthRequest",
  "offlinePass": {
    "passId": "opass_e4d3c2b1a0f9e8d7c6b5",
    "sub": "sub_premiumUser42XyZ",
    "deviceId": "d7e8f9a0b1c2d3e4f5a6b7c8d9e0f1a2",
    "devicePublicKey": "Ak1wIBZUEjiPnqJJaQEVkUCxNdBSRFuiqdMMyNeXWK5U",
    "keyId": "YjX5pR0TzmU3ubs17wImQQ",
    "issuedAt": "2026-02-12T14:30:00.000Z",
    "expiresAt": "2026-02-13T14:30:00.000Z",
    "policyVersion": 3,
    "revocationEpoch": 2,
    "offlineAllowance": {
      "maxTotalCredits": 2000,
      "maxUses": 20,
      "maxCreditsPerTx": 500
    },
    "constraints": {
      "minIntervalSec": 60
    },
    "signatureAlgorithm": "ECDSA-P256-SHA256",
    "signature": "MEQCIHoH4TWiuBQYEX7rD1zv56aiaafIR0wRzjGR8xrHrwQLAiAgAoy6nFpGQjExd9RcVOeGaUgPYtFbJhJUjRSDI+/KtA=="
  },
  "counter": 7,
  "bayId": "bay_a1b2c3d4e5f6",
  "serviceId": "svc_basic",
  "requestedDurationSeconds": 300,
  "sessionProof": "Z2CslLwYw8mNTbU2MPkHX4Ijy3oK5+5u+pWl8ycC0QY=",
  "deviceProof": {
    "format": "android-key",
    "signature": "MEQCIHWmYnYLiEPB7KvEwmfGQaUdzu385+tPHb9RIn32r2/MAiA62dqH8+IkKiCdznI5iyCKytFQEL/kr9DDzFRDC9PQdQ=="
  }
}
