{
  "type": "OfflineAuthRequest",
  "offlinePass": {
    "passId": "opass_a1b2c3d4e5f6a7b8",
    "sub": "sub_xyz789",
    "deviceId": "device_a8f3bc12e4567890",
    "devicePublicKey": "A0xX3DTR7Imb4hzGyaH1WyUX/5U/CIghk7B/cZV11KFi",
    "keyId": "YjX5pR0TzmU3ubs17wImQQ",
    "issuedAt": "2026-02-13T06:00:00.000Z",
    "expiresAt": "2026-02-14T06:00:00.000Z",
    "policyVersion": 1,
    "revocationEpoch": 42,
    "offlineAllowance": {
      "maxTotalCredits": 100,
      "maxUses": 5,
      "maxCreditsPerTx": 30
    },
    "constraints": {
      "minIntervalSec": 60
    },
    "signatureAlgorithm": "ECDSA-P256-SHA256",
    "signature": "MEQCIEdmkzFrxGI2oFsnkRwMay8MkqW1LNqYOnpwGkx/0fyRAiAfeKR7knNY/2igxjLMVp3FLthLwOMLIbFrOyft/MwYEQ=="
  },
  "counter": 5,
  "bayId": "bay_a1b2c3d4e5f6",
  "serviceId": "svc_eco",
  "requestedDurationSeconds": 300,
  "sessionProof": "CSzb7m/7wtCkHmR3aKmT7mF6U3DiUHVBtp67tLr5RO8=",
  "deviceProof": {
    "format": "android-key",
    "signature": "MEUCIQDbnWZkvAJJsgkPAeYJaMZYBx7Jp7XD38NKA/cpDJTdwwIgUr3FKIO1IOuxZzvoAY9NXE21GRPNkmMPC++NcDJFIZQ="
  }
}
